mysql> create database movie;
Query OK, 1 row affected

mysql> use movie;
Database changed
mysql> create table movie
    -> (xh char(4),
    -> yp char(4),
    -> sc int,
    -> dy char(20),
    -> zy char(40),
    -> lx char(20),
    -> sylx char(10),
    -> pj int);
Query OK, 0 rows affected

mysql> desc movie;
+-------+----------+------+-----+---------+-------+
| Field | Type     | Null | Key | Default | Extra |
+-------+----------+------+-----+---------+-------+
| xh    | char(4)  | YES  |     | NULL    |       |
| yp    | char(4)  | YES  |     | NULL    |       |
| sc    | int(11)  | YES  |     | NULL    |       |
| dy    | char(20) | YES  |     | NULL    |       |
| zy    | char(40) | YES  |     | NULL    |       |
| lx    | char(20) | YES  |     | NULL    |       |
| sylx  | char(10) | YES  |     | NULL    |       |
| pj    | int(11)  | YES  |     | NULL    |       |
+-------+----------+------+-----+---------+-------+
8 rows in set

mysql> insert movie
    -> values('1','战马',146,'史蒂文·斯皮尔伯格','杰瑞米·艾文 彼得·穆兰 艾米丽·沃森','战争/剧情/历史','正在上映',100),
    -> ('2','我愿意',106,'孙周','李冰冰/ 孙红雷/ 段奕宏','爱情/喜剧','正在上映',70),
    -> ('3','那些年，我们一起追的女孩',100,'九把刀','柯震东 陈妍希 郝邵文','剧情/爱情','已经下线',null),
    -> ('4','新龙门客栈',88,'李惠民','张曼玉 林青霞 梁家辉','动作/武侠/古装','已经下线',null),
    -> ('5','异星战场',132,'安德鲁·斯坦顿','泰勒·克奇 琳恩·柯林斯 威廉·达福','科幻/奇幻/动作/冒险','即将上映',120),
    -> ('6','春娇与志明',100,'彭浩翔','余文乐 杨千嬅 杨幂','爱情/剧情/喜剧','即将上映',70
);
Query OK, 6 rows affected
Records: 6  Duplicates: 0  Warnings: 3

mysql> select * from movie;
+----+----------+-----+-------------------+-----------------------------------+---------------------+----------+------+
| xh | yp       | sc  | dy                | zy                                | lx                  | sylx     | pj   |
+----+----------+-----+-------------------+-----------------------------------+---------------------+----------+------+
| 1  | 战马     | 146 | 史蒂文·斯皮尔伯格 | 杰瑞米·艾文 彼得·穆兰 艾米丽·沃森 | 战争/剧情/历史      | 正在上映 |  100 |
| 2  | 我愿意   | 106 | 孙周              | 李冰冰/ 孙红雷/ 段奕宏            | 爱情/喜剧           | 正在上映 |   70 |
| 3  | 那些年， | 100 | 九把刀            | 柯震东 陈妍希 郝邵文              | 剧情/爱情           | 已经下线 | NULL |
| 4  | 新龙门客 |  88 | 李惠民            | 张曼玉 林青霞 梁家辉              | 动作/武侠/古装      | 已经下线 | NULL |
| 5  | 异星战场 | 132 | 安德鲁·斯坦顿     | 泰勒·克奇 琳恩·柯林斯 威廉·达福   | 科幻/奇幻/动作/冒险 | 即将上映 |  120 |
| 6  | 春娇与志 | 100 | 彭浩翔            | 余文乐 杨千嬅 杨幂                | 爱情/剧情/喜剧      | 即将上映 |   70 |
+----+----------+-----+-------------------+-----------------------------------+---------------------+----------+------+
6 rows in set

mysql> alter table movie modify yp char(20) not null;
Query OK, 6 rows affected
Records: 6  Duplicates: 0  Warnings: 0

mysql> select * from movie;
+----+----------+-----+-------------------+-----------------------------------+---------------------+----------+------+
| xh | yp       | sc  | dy                | zy                                | lx                  | sylx     | pj   |
+----+----------+-----+-------------------+-----------------------------------+---------------------+----------+------+
| 1  | 战马     | 146 | 史蒂文·斯皮尔伯格 | 杰瑞米·艾文 彼得·穆兰 艾米丽·沃森 | 战争/剧情/历史      | 正在上映 |  100 |
| 2  | 我愿意   | 106 | 孙周              | 李冰冰/ 孙红雷/ 段奕宏            | 爱情/喜剧           | 正在上映 |   70 |
| 3  | 那些年， | 100 | 九把刀            | 柯震东 陈妍希 郝邵文              | 剧情/爱情           | 已经下线 | NULL |
| 4  | 新龙门客 |  88 | 李惠民            | 张曼玉 林青霞 梁家辉              | 动作/武侠/古装      | 已经下线 | NULL |
| 5  | 异星战场 | 132 | 安德鲁·斯坦顿     | 泰勒·克奇 琳恩·柯林斯 威廉·达福   | 科幻/奇幻/动作/冒险 | 即将上映 |  120 |
| 6  | 春娇与志 | 100 | 彭浩翔            | 余文乐 杨千嬅 杨幂                | 爱情/剧情/喜剧      | 即将上映 |   70 |
+----+----------+-----+-------------------+-----------------------------------+---------------------+----------+------+
6 rows in set

mysql> delete from movie;
Query OK, 6 rows affected

mysql> select * from movie;
Empty set

mysql> insert movie
values('1','战马',146,'史蒂文·斯皮尔伯格','杰瑞米·艾文 彼得·穆兰 艾米丽·沃森','战争/剧情/历史','正在上映',100),
('2','我愿意',106,'孙周','李冰冰/ 孙红雷/ 段奕宏','爱情/喜剧','正在上映',70),
('3','那些年，我们一起追的女孩',100,'九把刀','柯震东 陈妍希 郝邵文','剧情/爱情','已经下线',null),
('4','新龙门客栈',88,'李惠民','张曼玉 林青霞 梁家辉','动作/武侠/古装','已经下线',null),
('5','异星战场',132,'安德鲁·斯坦顿','泰勒·克奇 琳恩·柯林斯 威廉·达福','科幻/奇幻/动作/冒险','即将上映',120),
('6','春娇与志明',100,'彭浩翔','余文乐 杨千嬅 杨幂','爱情/剧情/喜剧','即将上映',70);
Query OK, 6 rows affected
Records: 6  Duplicates: 0  Warnings: 0

mysql> select * from movie;
+----+--------------------------+-----+-------------------+-----------------------------------+---------------------+----------+------+
| xh | yp                       | sc  | dy                | zy                                | lx                  | sylx     | pj   |
+----+--------------------------+-----+-------------------+-----------------------------------+---------------------+----------+------+
| 1  | 战马                     | 146 | 史蒂文·斯皮尔伯格 | 杰瑞米·艾文 彼得·穆兰 艾米丽·沃森 | 战争/剧情/历史      | 正在上映 |  100 |
| 2  | 我愿意                   | 106 | 孙周              | 李冰冰/ 孙红雷/ 段奕宏            | 爱情/喜剧           | 正在上映 |   70 |
| 3  | 那些年，我们一起追的女孩 | 100 | 九把刀            | 柯震东 陈妍希 郝邵文              | 剧情/爱情           | 已经下线 | NULL |
| 4  | 新龙门客栈               |  88 | 李惠民            | 张曼玉 林青霞 梁家辉              | 动作/武侠/古装      | 已经下线 | NULL |
| 5  | 异星战场                 | 132 | 安德鲁·斯坦顿     | 泰勒·克奇 琳恩·柯林斯 威廉·达福   | 科幻/奇幻/动作/冒险 | 即将上映 |  120 |
| 6  | 春娇与志明               | 100 | 彭浩翔            | 余文乐 杨千嬅 杨幂                | 爱情/剧情/喜剧      | 即将上映 |   70 |
+----+--------------------------+-----+-------------------+-----------------------------------+---------------------+----------+------+
6 rows in set

mysql> select yp,sylx from movie;
+--------------------------+----------+
| yp                       | sylx     |
+--------------------------+----------+
| 战马                     | 正在上映 |
| 我愿意                   | 正在上映 |
| 那些年，我们一起追的女孩 | 已经下线 |
| 新龙门客栈               | 已经下线 |
| 异星战场                 | 即将上映 |
| 春娇与志明               | 即将上映 |
+--------------------------+----------+
6 rows in set

mysql> select yp,pj*0.5 from movie;
+--------------------------+--------+
| yp                       | pj*0.5 |
+--------------------------+--------+
| 战马                     | 50     |
| 我愿意                   | 35     |
| 那些年，我们一起追的女孩 | NULL   |
| 新龙门客栈               | NULL   |
| 异星战场                 | 60     |
| 春娇与志明               | 35     |
+--------------------------+--------+
6 rows in set

mysql> select distinct pj from movie;
+------+
| pj   |
+------+
|  100 |
|   70 |
| NULL |
|  120 |
+------+
4 rows in set

mysql> select * from stu where sylx='正在上映';
1146 - Table 'movie.stu' doesn't exist
mysql> select * from movie where sylx='正在上映';
+----+--------+-----+-------------------+-----------------------------------+----------------+----------+-----+
| xh | yp     | sc  | dy                | zy                                | lx             | sylx     | pj  |
+----+--------+-----+-------------------+-----------------------------------+----------------+----------+-----+
| 1  | 战马   | 146 | 史蒂文·斯皮尔伯格 | 杰瑞米·艾文 彼得·穆兰 艾米丽·沃森 | 战争/剧情/历史 | 正在上映 | 100 |
| 2  | 我愿意 | 106 | 孙周              | 李冰冰/ 孙红雷/ 段奕宏            | 爱情/喜剧      | 正在上映 |  70 |
+----+--------+-----+-------------------+-----------------------------------+----------------+----------+-----+
2 rows in set

mysql> select